{
    "schema": "ark.workbench-development-decision-request.v1",
    "schema_version": "1.0",
    "decision_id": "gen4-r1-d1",
    "task_id": "gen4-r1",
    "contract_revision": "4ddb25bb5540c5e1",
    "raised_at": "2026-09-14T16:43:27+00:00",
    "raised_by": {
        "role": "implement",
        "model": null,
        "harness": "pi"
    },
    "authority_level": "L4",
    "question": "GEN4-R1 S2's acceptance criteria cannot be met without changing the trust surface you froze. Lift the freeze to widen the admissible evidence surface, or conclude the measurement here?",
    "why_now": "S2's work is correct and shipped (census 47/47; policy allowed_roles=admin granted in tenant 54; its test passes 14/14 with a negative control), but its evidence cannot be produced. COMMAND_ALLOWLIST admits only php tests/<name>.php (ROOT only), php -l, the contract linter and the Python rules; php -r, php ikabud workbench:governance, grep, git, module test paths and any ;-chained or redirected form are refused, and an unlisted command binds no claim - so five clean CLAIM/COMMAND blocks extracted ZERO claims. The commands that verify ordinary product work are inadmissible, and the admissible substitutes are vacuously true of the change, which B-F1 forbids. Honest evidence therefore requires changing the frozen trust surface, which CD-41 reserves to the owner. Two further measured defects were deliberately NOT repaired: the authority matcher matches 'auth' as an unanchored substring, so the word 'authority' in a filename trips an absolute prohibition; and isExistingTestPath() evaluates file_exists() after the run, so no slice can create a test file (CD-46).",
    "options": [
        {
            "id": "widen-and-rerun",
            "label": "Widen the allowlist, then re-run S2",
            "effect": "Admit bounded read-only commands (the governance census) and module test paths; S2 re-runs to a clean completion and later product slices become measurable",
            "cost": "one bounded trust-surface edit plus one re-run",
            "blast_radius": "medium: the allowlist is the trusted command boundary, so each new rule is a new execution surface",
            "reversibility": "reversible"
        },
        {
            "id": "bounded-commands-only",
            "label": "Widen to bounded commands only",
            "effect": "As above but module test paths stay inadmissible; slices must be evidenced by existing root tests",
            "cost": "one bounded edit",
            "blast_radius": "lower: no new path classes become executable",
            "reversibility": "reversible"
        },
        {
            "id": "conclude-measured",
            "label": "Conclude GEN4-R1 as measured",
            "effect": "Record the distribution and stop; no harness change now, and ordinary product slices remain unevidenced",
            "cost": "zero",
            "blast_radius": "none now",
            "reversibility": "reversible"
        }
    ],
    "recommendation": {
        "option_id": "widen-and-rerun",
        "rationale": "Option 'widen-and-rerun' best preserves the approved task boundary."
    },
    "default_if_no_response": "stop",
    "impact_of_no_decision": "The bounded run remains stopped until the director answers.",
    "already_done": [],
    "checkpoint": {
        "state": "pre-change",
        "git_head": null,
        "resume_command": "php tools/ai-autonomy.php resume gen4-r1-d1 --choose=<OPTION> --decisions-dir=.ai/decisions"
    },
    "evidence_refs": [],
    "transport": {
        "channel": "harpp-cli",
        "attempted": true,
        "delivered": true,
        "suppressed": false,
        "harpp_decision_id": "96",
        "error": null
    },
    "resolution": {
        "chosen_option_id": "widen-and-rerun",
        "decided_by": "director",
        "decided_at": "2026-09-14T23:39:03+00:00",
        "note": "",
        "source": "local"
    }
}
